{"authors":[{"name":"Exercise Book contributors","role":"author"},{"name":"Exercise Book curriculum review","role":"reviewer"}],"compilerVersion":"exercisebook-content-compiler/1","estimatedMinutes":15,"id":"math.fractions.add-unlike-denominators","license":{"attributionText":"Add fractions with unlike denominators © 2026 Exercise Book contributors. Licensed under CC BY 4.0.","copyrightHolder":"Exercise Book contributors","licenseId":"CC-BY-4.0","sourceUrl":"https://exercisebook.app/content/math/fractions/add-unlike-denominators"},"locale":"en","nodes":[{"children":[{"type":"text","value":"Add fractions with unlike denominators"}],"level":1,"type":"heading"},{"children":[{"type":"text","value":"To add fractions with different denominators, first rewrite both fractions with\nthe same denominator. Then add the numerators and reduce the result."}],"type":"paragraph"},{"children":[{"children":[{"type":"text","value":"The least common denominator of "},{"accessibleText":"2","source":"2","type":"math"},{"type":"text","value":" and "},{"accessibleText":"3","source":"3","type":"math"},{"type":"text","value":" is "},{"accessibleText":"6","source":"6","type":"math"},{"type":"text","value":". Rewrite "},{"accessibleText":"1 over 2","source":"\\frac{1}{2}","type":"math"},{"type":"text","value":" as\n"},{"accessibleText":"3 over 6","source":"\\frac{3}{6}","type":"math"},{"type":"text","value":" and "},{"accessibleText":"1 over 3","source":"\\frac{1}{3}","type":"math"},{"type":"text","value":" as "},{"accessibleText":"2 over 6","source":"\\frac{2}{6}","type":"math"},{"type":"text","value":". Then add:\n"},{"accessibleText":"3 over 6 + 2 over 6 = 5 over 6","source":"\\frac{3}{6} + \\frac{2}{6} = \\frac{5}{6}","type":"math"},{"type":"text","value":"."}],"type":"paragraph"}],"id":"worked-example-01","title":"One half plus one third","type":"worked-example"},{"children":[{"children":[{"type":"text","value":"Use the fraction bars to find an equivalent form for each addend."}],"type":"paragraph"}],"id":"fraction-bars-01","kind":"fraction-bars","printFallback":"Draw two equal bars, divide both into the common number of pieces, and shade each addend.","prompt":"Build both fractions with equal-sized pieces.","type":"interactive"},{"count":8,"generator":{"id":"fractions.add","parameters":{"difficulty":2},"version":"1"},"id":"practice-01","instruction":"Add each pair of fractions. Give every answer in lowest terms.","type":"exercise"},{"children":[{"children":[{"type":"text","value":"How can you tell that two fractions are ready to be added?"}],"type":"paragraph"}],"id":"reflection-01","type":"reflection"}],"prerequisites":["math.fractions.equivalent"],"publication":{"status":"draft"},"revision":3,"schema":"exercisebook.content-ast/v1","skills":["math.fractions.add-unlike"],"sourceHash":"9654184d51610bbbdd82ce6b3d0f33de0addb51bc0427c99ef4ecc62a1983047","title":"Add fractions with unlike denominators"}